id,url,title,header,text
9d9054c0-bdbf-4321-8e42-be12915c6220,https://examine.com/categories/autoimmune-disease/,Autoimmune Disease,What is autoimmune disease?,"Our immune system keeps us healthy by fighting off invading pathogens while simultaneously sparing our own cells and tissues. In healthy people, the immune system is able to distinguish between the self and nonself, a concept called self-tolerance. When the body is functioning properly, the immune system maintains self-tolerance while working in the background to protect the body from infections.In people with autoimmune disease, self-tolerance does not function correctly, causing the body to turn the powerful weapons of the immune system against self molecules, causinginflammationand injury. Autoimmune disease can be systemic, affecting multiple parts of the body, such as in diseases likesystemic lupus erythematosus(SLE). They can also be organ-specific, such as intype 1 diabetes, where the immune system targets and destroys theinsulin-producing cells of the pancreas."
88319419-7d2d-44da-9600-dc2deee7280a,https://examine.com/categories/autoimmune-disease/,Autoimmune Disease,How could diet affect autoimmune disease?,"Preclinical studies show that dietary interventions, such as elimination diets and calorie restriction in various forms (e.g., chronic caloric restriction, time-restricted feeding (TRF), andintermittent fasting, etc.) can potentially have beneficial effects on the immune system. However, more human trials are still needed to provide a better understanding of when, and in whom, these interventions are effective. It is also important to keep in mind that the efficacy and safety of diet interventions will likely vary from person to person, with some potentially being harmful for certain people.Metabolic status in the body is intimately connected to immune function. For example, undernourished people tend to be more susceptible to infections, while the nutrient excess associated with the Western diet may be associated with increased risk of autoimmunity.[1]This suggests that in the future, appropriate diet interventions could potentially help to reduce disease activity in people with active disease, or even lessen disease risk in those who are susceptible."
76d97adc-8449-4a87-b3ff-6a4c0f91e253,https://examine.com/categories/autoimmune-disease/,Autoimmune Disease,Which supplements are of most interest for autoimmune disease?,"Many supplements, particularly those with antioxidant or anti-inflammatory activity, have been investigated for their ability to reduce the severity or incidence of autoimmune disease. To date, some of the more promising evidence is forvitamin Dandfish oil, which were linked to reduced incidence of autoimmunity in a large randomized controlled trial.[2]Further research is needed to better understand the way that supplements may affect the incidence or severity of autoimmunity in different people."
ceeff9bb-8f9c-46df-aa6c-499d6686b56e,https://examine.com/conditions/celiac-disease,Celiac Disease,What is celiac disease?,"Celiac disease, also calledgluten-sensitive enteropathy, is an immune disorder that causes damage to the small intestine.[1]Although celiac disease has some symptoms in common with gluten sensitivity and wheat allergies, only celiac disease damages thegastrointestinal(GI) tract. In addition to causing a range of GI symptoms, celiac disease can also affect multiple organ systems in the body.[2]Although celiac disease is sometimes considered to be an autoimmune disorder, based on the production of autoantibodies and other features associated withautoimmune disease,[3]it is not clear whether autoimmunity plays a major role in damaging the small intestine.[4]"
1ec67018-c18e-4ac4-9a5e-9fe117119d56,https://examine.com/conditions/celiac-disease,Celiac Disease,What are the main signs and symptoms of celiac disease?,"Damage to the small intestine caused by celiac disease can lead to an array of symptoms in different individuals.[5]The main symptoms can include any of the following:Abdominal painNausea or vomitingGasConstipationChronic diarrheaAbnormal stoolsLactose intolerancePeople with celiac disease may also experience symptoms in other parts of the body, including the following:FatigueBone or joint painMental health problems, such as depression or anxietyInfertilityDelayed menstrual cycleNervous system problems, such as impaired balance, headaches, peripheral neuropathy, or seizuresDermatitis herpetiformis(DH), an itchy, blistering skin rash
These other symptoms can be due to micronutrient deficiencies from malabsorption (caused by damage to the small intestine) or, in the case of DH, an autoimmune reaction to gluten ingestion."
fc6325c7-4733-46ed-b6ee-b1e3c18a3ad3,https://examine.com/conditions/celiac-disease,Celiac Disease,How is celiac disease diagnosed?,"Since celiac disease has symptoms that are common with other digestive disorders such as irritable bowel syndrome, a physical exam alone isn’t enough to diagnose the disease. Doctors will also review the patient’s family medical history to determine whether anybody has been diagnosed with celiac disease. Genetic testing is also often performed to look for gene variants linked to increased disease risk. The only way to confirm a diagnosis of celiac disease is through the detection of specific antibodies in the blood and confirmation of damage tovilli(tiny nutrient-absorbing structures) in the small intestine through a biopsy.[5]It is important to note that a positive diagnosis is only possible after gluten exposure for several weeks before the test. People on gluten-free diets may be advised by their physician to start a “gluten challenge,” which involves several weeks of continuous gluten exposure, since elimination of gluten from the diet can lead to a false-negative diagnosis.[6]"
3a37470a-972f-4b9c-8808-189f1686e45e,https://examine.com/conditions/celiac-disease,Celiac Disease,What are some of the main medical treatments for celiac disease?,"Since celiac disease is triggered bygluten, the main treatment is a gluten-free diet. Eliminating gluten exposure allows the small intestine to heal, improving symptoms over time. Although symptoms can improve within days to weeks after starting a gluten-free diet, some, such as dermatitis herpetiformis, are not resolved for up to 2 years. Steroids and other immunosuppressants can also be used to help relieve symptoms while the small intestine heals."
05f22820-4fec-4864-af86-f6a71918f8ee,https://examine.com/conditions/celiac-disease,Celiac Disease,Have any supplements been studied for celiac disease?,"The main supplements recommended for celiac disease are micronutrients, since damage to the small intestinal reduces their absorption. Deficiencies invitamin B6,vitamin B12,iron,folic acid,vitamin D,copper,zinc, andmagnesiumare common in people with celiac disease.[7]Gluten-free foods also tend to provide lower levels of magnesium, possibly warranting supplementation if insufficient levels are obtained through the diet after small intestinal damage has healed.[8]Probiotics have also been studied, since celiac disease is associated with changes in the gut microbiome.[9]Omega-3 fatty acid supplements have additionally been researched for their ability to reduce inflammation in celiac disease.[10]"
127f5a55-813a-453a-85ba-bbe7d2e77fca,https://examine.com/conditions/celiac-disease,Celiac Disease,How could diet affect celiac disease?,"Since celiac disease is triggered by gluten exposure, it is essential to eliminate gluten from the diet. This rules out any foods that contain wheat, barley, rye, triticale (a cross between wheat and rye), kamut, or farro; this includes semolina, couscous, most cereals, pasta, beers, breads, crackers, wraps, and baked goods. People with celiac disease also need to be careful to avoid hidden exposure to gluten, which can occur with processed foods. For example, processed foods based on corn or rice (neither of which contain gluten) could contain trace amounts of contaminating gluten if they were produced in factories that also make wheat products."
0a125c81-10e1-48b7-9ba3-3f04a4364875,https://examine.com/conditions/celiac-disease,Celiac Disease,Are there any other treatments for celiac disease?,"Gluten-free diets can be tough to adhere to, creating a large interest in non-dietary therapies. Drug therapies that target various mechanisms of the disease process are under development. Some promising candidates are currently undergoing clinical trials, but none have been approved so far.[11]"
9d7c1676-f221-4178-9279-adb0e293e376,https://examine.com/conditions/celiac-disease,Celiac Disease,What causes celiac disease?,"Celiac disease is caused by an abnormal immune reaction to gluten. Consuming gluten triggers destruction ofvilli, tiny finger-like projections lining the small intestine that absorb nutrients from food. People who are genetically susceptible have particular variants of the genes encodingmajor histocompatibility complex(MHC) class II molecules, which play a role in the sensing of foreign proteins by the immune system. The MHC class II genes HLA-DQ2 or HLA-DQ8 bind to gluten-derived peptides, triggering the immune response that causes intestinal damage. Although HLA-DQ2 or HLA-DQ8 seem to be required to develop the disease, they are not sufficient, since only 1% of the population has celiac disease, in spite of 40% having HLA-DQ2 or HLA-DQ8.[12]"
526733d7-b175-490d-8a6d-cfceac65571b,https://examine.com/conditions/crohns-disease,Crohn's Disease,What is Crohn’s Disease?,"Crohn’s disease is aninflammatory bowel diseasethat causes inflammation and irritation in the lining of thegastrointestinal(GI) tract. It commonly affects the small and large intestine, but can occur at any point from the mouth to the anus. It tends to worsen over time, but periods of remission (where symptoms disappear) may last weeks or years. Though it can develop in anyone at any age, a person is more likely to develop it in their twenties. Additional risk factors include smoking and family history of inflammatory bowel disease.Crohn’s disease can increase the risk of developing colon cancer, fistulas (abnormal tunnels in the GI tract), abscesses, anal fissures (small tears), intestinal obstructions, and inflammation in other areas of the body.[1]"
6ebfeb12-66ab-4aae-8526-961129370777,https://examine.com/conditions/crohns-disease,Crohn's Disease,What are the main signs and symptoms of Crohn’s Disease?,"The most common symptoms of Crohn’s disease are diarrhea (occasionally bloody), abdominal pain and cramping, and unexplained weight loss. Other potential signs and symptoms include nausea, reduced appetite, joint or eye pain,fatigue, anemia, or fever.[2]"
6a9aa58e-c3fc-49b7-9a13-95cf2565f149,https://examine.com/conditions/crohns-disease,Crohn's Disease,How is Crohn’s Disease diagnosed?,"After gathering a medical history, a doctor (usually a gastroenterologist) will perform a number of exams and tests to diagnose Crohn’s Disease. They will likely start with a physical exam to check forbloatingand abdominal tenderness and listen to the sounds of the GI tract. Other diagnostic tests may include blood tests to detect anemia and inflammation, stool tests to rule out other diseases, endoscopies (such as a colonoscopy) to view the GI tract lining and collect biopsies, or imaging tests such as acomputed tomography(CT) scan.[3]"
3f77e7b2-68c6-442b-b060-e3389ca13640,https://examine.com/conditions/crohns-disease,Crohn's Disease,What are some of the main medical treatments for Crohn’s Disease?,"There is no cure for Crohn’s Disease, but it can be managed with long-term care from a gastroenterologist and anti-inflammatory medications that suppress the immune system or interrupt inflammatory processes to prevent damage to the intestinal lining and, in some cases, initiate remission.Anti-diarrheal medications and acetaminophen (also known as paracetamol or the brand name Tylenol) can be used to treat diarrhea and abdominal pain, and antibiotics are used to treat infections that might occur (such as abscesses). Fistulas, anal fissures, and ulcers can be treated with medication and dietary modifications, but in some cases, severely damaged sections of the intestine may need to be surgically removed and rerouted or attached to a reservoir to enable the passage of stool.Severe symptoms may also require bowel rest, which can involve partial enteral nutrition — using specific liquid formulas to meet a patient’s dietary needs — or delivering nutrients intravenously to bypass the GI tract completely. Partial enteral nutrition may help to prevent flares when a patient is in remission, especially when fed through a nasogastric tube that delivers the formula directly into the stomach through the nose.[4][5]"
a3c2ed22-db26-4d76-95f4-242ac57afde4,https://examine.com/conditions/crohns-disease,Crohn's Disease,Have any supplements been studied for Crohn’s Disease?,"Probiotics, prebiotics, and synbiotics have all been studied for IBD, but they appear to be much more effective inulcerative colitisthan in Crohn’s disease.[6][7]Resveratrolcould improve both GI symptoms and quality of life.[8][9]"
8010f901-cb16-4abd-86e1-e18321d53ff8,https://examine.com/conditions/crohns-disease,Crohn's Disease,How could diet affect Crohn’s Disease?,"No specific dietary interventions are recommended for people with Crohn’s disease. The specific carbohydrate diet andMediterranean dietwere equally effective when comparing six-week remission rates, while theautoimmune protocol dietimproved quality of life. However, these studies lacked control groups, and because Crohn’s disease can enter remission spontaneously, it’s unclear whether the diets caused remission.[10][11]Alow-FODMAP dietmay reduce some GI symptoms, but doesn’t reduce disease activity.[12]Other exclusion diets — like those that remove carrageenan or animal products or require the use of organic foods — have little to no effect on IBD disease activity or remission rates.[13]People with Crohn’s disease may have lower circulating levels of fat-soluble vitamins A, D, E, and K, and low vitamin A status was associated with higher levels ofC-reactive proteinin one meta-analysis.[14]Additionally, they might not be eating adequate calories, so supplementation may be recommended.[15]"
d5b77f14-1066-4491-9862-9094c6f294e9,https://examine.com/conditions/crohns-disease,Crohn's Disease,Are there any other treatments for Crohn’s Disease?,"Fecal microbiota transplants appear effective for inducing remission in IBD, but most of the available trials for Crohn’s disease lack control groups, so more confirmatory trials are needed.[16]Bothmindfulnessexercises and cognitive behavioral therapy can improve quality of life, and regular exercise is an effective way to manage disease-relatedfatigue.[9][17][18]Although hyperbaric oxygen therapy is associated with remission and clinical improvements in Crohn’s disease, most studies have serious design flaws (like a lack of randomization or control groups), so it’s unclear whether those occurred as a result of the treatment or as a normal part of the disease process.[19]"
a17d0014-ecf5-45ec-afcf-149d969b2c3f,https://examine.com/conditions/crohns-disease,Crohn's Disease,What causes Crohn’s Disease?,"The cause of Crohn’s Disease is unknown, but researchers believe it could be due to an autoimmune reaction potentially triggered by gut microbes, and that genes could also play a role.In observational studies, a Western dietary pattern is associated with an increased risk of developing Crohn’s disease, while dietary fiber, fruit, vegetable, and fish intake are associated with a reduced risk.[20][21][22]Smoking may double the chances of developing Crohn’s disease, while other lifestyle factors — such asnon-steroidal anti-inflammatory drugs(NSAIDs), antibiotics, and certain types of birth control pills — may increase the risk, but only slightly.[2]"
11c897a4-b4fe-4f0c-95d3-a1631dcb873f,https://examine.com/conditions/dermatitis,Dermatitis,What is dermatitis?,"Dermatitis is a general term used to describe skin inflammation resulting from a wide variety of skin conditions. Common causes of dermatitis includeeczema, contact dermatitis, and seborrheic dermatitis (of whichdandruffis a mild form).[1]Other causes include vascular disease, which causes stasis dermatitis,[2]or photosensitivity, which is an abnormal reaction to sun exposure.[3]"
791fcf62-591b-4641-bee8-af48b418459b,https://examine.com/conditions/dermatitis,Dermatitis,What are the main signs and symptoms of dermatitis?,"People with dermatitis experience skin redness, irritation, and itchiness. The skin may blister, ooze, and appear flaky in severe cases."
a8dd43fd-70cc-42aa-a88d-12b4fdc3047d,https://examine.com/conditions/dermatitis,Dermatitis,How is dermatitis diagnosed?,"Diagnosis is based upon medical and physical assessment findings. If these findings are unclear, further testing such as skin prick testing, blood tests measuring immune reactivity to allergens, or biopsy may be performed."
67bc8c20-1610-40cc-b111-8274d05d320e,https://examine.com/conditions/dermatitis,Dermatitis,What are some of the main medical treatments for dermatitis?,"Moisturizers, topical corticosteroids, and topical calcineurin inhibitors are the first-line treatments for most cases of dermatitis. Treatment choice depends upon the severity, location, and type or cause of dermatitis.[1]For contact dermatitis, avoiding the offending trigger is the first-line treatment."
e812390c-905b-498f-8c67-e8d3a50f2ce4,https://examine.com/conditions/dermatitis,Dermatitis,Have any supplements been studied for dermatitis?,"Supplements that have shown potential benefits for treatingeczemaare oralVitamin E, topicalVitamin B12,[4]Vitamin D,[5]andprobiotics.[6]. One study found thatwhey proteinreduced symptoms of contact dermatitis[7]. Additionally, people who are deficient in certain minerals and nutrients —Vitamin B2,Vitamin B3,Vitamin B12,zinc,iron— often present with dermatitis-like symptoms.[8]In this case, supplementation of the deficient nutrient is advised."
7b8321b0-36a7-4604-9b36-2c72ef4c1ba8,https://examine.com/conditions/dermatitis,Dermatitis,What’s the connection between diet and dermatitis?,"Allergies to certain foods can cause or worsen dermatitis. The most common food allergies include peanuts, cow’s milk, soy, shellfish, wheat, and nuts.[9]Furthermore, in some people the autoimmune conditionceliac diseasecan manifest asdermatitis herpetiformis(DH); people with DH develop blistering rashes after consuming gluten-containing foods.[10]"
aa2cb5a1-9f75-44b5-9942-dc30a21b346f,https://examine.com/conditions/dermatitis,Dermatitis,Are there any other treatments for dermatitis?,"Avoiding irritating fabrics such as thick-fiber wool can mitigate symptoms ofeczema,[11]and reducing exposure to known irritants such as pollen, dust, fragrances, etc. can reduce symptoms of contact dermatitis.[1]Fine merino wool has been demonstrated to be helpful for people witheczema, despite the fact that thick-fiber wool may exacerbateeczemasymptoms.[11]Furthermore, phototherapy has been shown to be beneficial in people witheczemathat does not respond to initial treatments.[12]"
900d3d64-8415-49e8-8940-f03afef34989,https://examine.com/conditions/dermatitis,Dermatitis,What causes dermatitis?,"Dermatitis can be caused by endogenous (within the body) or exogenous (outside the body) factors. Endogenous dermatitis involves a pathology within the body. Examples areeczemaand stasis dermatitis. On the other hand, exogenous dermatitis is precipitated by contact with substances outside the body. Examples are irritant contact dermatitis, allergic contact dermatitis, and photosensitive dermatitis.[1]"
a6c517e5-b1d7-4240-8f82-52f6ae26c18f,https://examine.com/conditions/dry-eye,Dry Eye,What is a dry eye?,"Under normal conditions, our eyes are constantly making tears to keep the surface of the eye moist. Although tears are typically considered as a simple, homogeneous substance, we have a complex tear film that keeps our eyes healthy and comfortable, which consists of three distinct layers. Every time we blink, the tear film coats the surface of the eye, which helps to keep them clean and clear. If insufficient amounts of the tear film or its composition is off, dry eyes can occur.[1]"
5ad6bc91-2047-442e-9ab7-577e0c32e089,https://examine.com/conditions/dry-eye,Dry Eye,What are the main signs and symptoms of dry eye?,"Symptoms of dry eyes include redness or irritation, which is especially evident in the wind, stinging or burning sensation in the eyes, blurred vision, can be especially noticeable when reading, a scratchy or gritty feeling, that feels like sand in the eye, presence of strings of mucus in and around the eyes, pain and discomfort while wearing contact lenses, increased amounts of tears in the eye."
7548331e-51d1-4dde-bb19-7f3331dfa961,https://examine.com/conditions/dry-eye,Dry Eye,How is dye eye diagnosed?,"Dry eye is diagnosed by an ophthalmologist, who will start with an eye exam to look at the eyelids and surface of the eye. Ophthalmologists may perform different tests to diagnose dry eyes including the following:Examine amount of tears that your eyes makeDetermine how long it takes tears to dry upExamine eyelid structure"
f6c3f2c2-dfb3-4bd4-9f6c-9ad98191c9b1,https://examine.com/conditions/dry-eye,Dry Eye,What are some of the main medical treatments for dry eye?,"Artificial tears are one treatment for dry eyes, which are available without a prescription and can be administered multiple times per day.Prescription eye drop medications may also be recommended to help the eyes make more of their own tears.Newer treatments are also available (or are being developed) that specifically target the underlying causes of dry eyes.[2]Blocking tear ducts is another treatment that may be recommended by an ophthalmologist."
87ea4728-b83a-4e45-8c48-55ad4eed0389,https://examine.com/conditions/dry-eye,Dry Eye,Have any supplements been studied for dry eye?,"Pycnogenol, a patented formulation of pine bark extract, has shown promise for alleviating dry eyes in patients with Sjogren’s disease, a common autoimmune condition in women that causes dry eyes and dry mouth. The mechanism of action isn’t clear but may be due to the anti-inflammatory effects of pycnogenol.Fish oiland omega 3 fatty acid supplements have been also have been studied for dry eyes. However, their efficacy across different studies has been inconsistent, with some meta analyses more optimistic on their efficacy for treating dry eye symptoms[3]than others.[4]Although one extensively cited cross-sectional study found that higher omega-3 fatty acid consumption was associated with a 17% lower risk of dry eye in a cohort of 32,000 women,[5]more research is needed to determine their efficacy for the relief of dry eye symptoms of varying etiology in different populations. As withpycnogenol, therapeutic mechanisms of action are not well understood, but likely involve the anti-inflammatory activity of omega-3 fats."
27b21857-0898-425d-8033-554e6a389e51,https://examine.com/conditions/dry-eye,Dry Eye,How could diet affect dry eye?,"Good nutrition helps to keep the eye healthy overall and may reduce the risk of eye diseases such as dry eye. Overall, getting plenty of leafy green vegetables along with yellow, orange, and other colorfulfruits and vegetableswill help to keep the eyes healthy.[6]Dietary patterns that are good for the heart may also be good for the eyes, since the eyes rely on tiny arteries to deliver oxygen and nutrients. As with the heart, keeping blood vessels healthy will help to keep the eyes healthy."
b75e3863-493d-4cbc-8efb-31ab47679758,https://examine.com/conditions/dry-eye,Dry Eye,Are there any other treatments for dry eye?,"The most common non-medical treatments for dry eye, such as artificial tears and lubricating eye drops are available over the counter, without a prescription. Although this is a good place to start if you have infrequent issues with dry eyes, it is important to see a doctor if symptoms persist or become worse."
03beb6be-4c8a-4649-8b4a-27df926c7668,https://examine.com/conditions/dry-eye,Dry Eye,What causes dry eye?,"Hormonal changes during aging can be a cause of dry eye. Although both men and women can get dry eye, it tends to be more common in women, especially aftermenopause. There are many other causes of dry eye, which including autoimmune diseases such asrheumatoid arthritis, Sjogren's syndrome, and lupus, thyroid disease, smoke exposure, wind exposure, or being in a dry climate, prolonged activities that reduce blinking such as working at a computer screen for long periods of time, or reading, wearing contact lenses for an extended period of time, refractive eye surgery such as LASIK.Additionally, medications that can cause dry eyes include diuretics, beta-blockers, antihistamines, sleeping pills, medications foranxietyordepression, and heartburn medications.[2]"
24c645c3-34d5-4257-a119-4fcd108065d9,https://examine.com/conditions/eczema,Eczema (Atopic Dermatitis),What is eczema?,"Atopic dermatitis, also called eczema, is a common skin condition. ""Atopic"" refers to a heightened sensitivity toward allergens, leading to frequent, excessive immune reactions that inflame and irritate the skin (dermatitis). Other atopic diseases includeallergic rhinitisandasthma. It is most common during childhood, with a prevalence of up to 25% of children affected, but can persist into adulthood; over a lifetime, 7–10% of people will get eczema at some point.[1]"
