id,url,title,header,text
eec67619-f2c2-4f56-854f-70ab0eb3ab5c,https://examine.com/conditions/macular-degeneration,Macular Degeneration,How is macular degeneration diagnosed?,"The main method of diagnosing macular degeneration is a dilated fundus examination, in which the back of the eye (the fundus) is examined for the presence of drusen and certain pigmentation abnormalities. If macular degeneration is present, additional tests (e.g., optical coherence tomography, fluorescein angiography) are required to either diagnose or rule out wet/neovascular macular degeneration. Ophthalmological examinations are also used to assess visual function and eyesight changes."
ae11710d-6a43-43e6-b471-1fd923219245,https://examine.com/conditions/macular-degeneration,Macular Degeneration,What are some of the main medical treatments for macular degeneration?,"There is no cure for macular degeneration, meaning treatment is focused on preventing or slowing progression. This involves avoiding risk factors that make the disease worse, like smoking. In the case of wet/neovascular macular degeneration, disease progression can be slowed with drugs called VEGF inhibitors, which are injected into the eye.[4]"
c5c168c1-2041-4828-9fb1-eb326d4d9f8e,https://examine.com/conditions/macular-degeneration,Macular Degeneration,Have any supplements been studied for macular degeneration?,"Several supplements, often in combination, have been tested for their effect on macular degeneration, including vitamin C, vitamin E, zinc, lutein, and zeaxanthin.[5][6][7]Notably, one large clinical trial found that supplementation with lutein and zeaxanthin slowed disease progression among people with intermediate stage macular degeneration.[8]"
57a646fa-9117-4771-ae87-0f536f7a5867,https://examine.com/conditions/macular-degeneration,Macular Degeneration,How could diet affect macular degeneration?,"A Mediterranean dietary pattern has been linked to a lower risk of the disease and slower disease progression.[9]Among individual foods, eating more fish is associated with a lower risk of developing macular degeneration,[10]while eating more red meat tends to be associated with a higher risk.[11]Foods rich in lutein and zeaxanthin (like green vegetables and eggs) may also help reduce the risk of developing late stage macular degeneration.[12][13][14]"
1d0463c1-7117-4c09-bc2d-c9c3b8813fa8,https://examine.com/conditions/macular-degeneration,Macular Degeneration,Are there any other treatments for macular degeneration?,"In rare cases, photodynamic therapy may be used to slow the progression of specific types of wet/neovascular macular degeneration.[15]The procedure involves administering a drug and exposing the eye to a type of light that “activates” the drug."
71ebee5e-f62b-4c70-bb42-c3a397ec099f,https://examine.com/conditions/macular-degeneration,Macular Degeneration,What causes macular degeneration?,"Macular degeneration is caused by damage to the macula, which is the area of the retina with the highest concentration of photoreceptor cells, and thus a key factor in eyesight. The exact cause of this damage is not well understood, but it may be related to inflammation, the accumulation of lipofuscin (a type of particle arising from cell damage), oxidative stress, and reduced autophagy (a process that eliminates dysfunctional cellular material).[16][17]Aging is one of the most well-established and strongest risk factors for macular degeneration. Other risk factors include smoking,[18]moderate-to-heavy alcohol consumption,[19]type 2 diabetes,[20]limited physical activity,[21]and a lighter colored iris (e.g., blue vs. brown).[3]Finally, genetics can have a significant impact on the risk of macular degeneration. Two genes (CFH and ARMS2) seem especially important, as common variations in these genes can significantly increase a person’s risk of developing the disease.[17]"
01e8c130-5856-4813-9a60-892ef83390f5,https://examine.com/conditions/male-sexual-dysfunction,Male Sexual Dysfunction,What is sexual dysfunction?,"In men, sexual dysfunction typically involves issues with one or more of the following factors:[1][2]Interest in sex/arousalGetting an erectionEjaculation"
68a5a128-c3fe-4dfb-8c14-fc64ec468630,https://examine.com/conditions/male-sexual-dysfunction,Male Sexual Dysfunction,What are the main signs and symptoms of sexual dysfunction?,Men who are experiencing sexual dysfunction may have the following symptoms:Lack of interest in sexDifficulty becoming arousedDifficulty getting or maintaining an erectionEjaculating too quickly or too slowlylow-testosterone
43531ee7-a208-42c6-93c1-0075d8e6ee90,https://examine.com/conditions/male-sexual-dysfunction,Male Sexual Dysfunction,How is sexual dysfunction diagnosed?,"Because many of the symptoms (e.g., satisfaction with time to ejaculation, level of interest in sex) are subjective, sexual dysfunction diagnoses are primarily based on what an individual identifies as problematic. A person’s emotions and previous experience can contribute to sexual dysfunction, so a full history and psychiatric evaluation may be useful. Similarly, lab tests can be used to identify or rule out physiological causes of sexual dysfunction.[2]"
7229a907-8f8f-42ef-bb3d-f2c6e5376e41,https://examine.com/conditions/male-sexual-dysfunction,Male Sexual Dysfunction,What are some of the main medical treatments for sexual dysfunction?,"Depending on the condition, a variety of medical treatments may be used:[2]ConditionMedical TreatmentsPremature ejaculationSelective serotonin reuptake inhibitors (SSRIs) Topical anesthetics (e.g., lidocaine)Delayed ejaculationCessation of medications that may cause delayed ejaculation (e.g., SSRIs, opioids)Erectile dysfunctionPhosphodiesterase-5 (PDE-5) inhibitors (e.g., sildenafil, vardenafil, tadalafil)Low libidoTestosterone replacement therapy and/or cessation of libido-reducing medications (e.g., SSRIs, opioids)Additionally, sexual dysfunction can be secondary to some other issue, such asdepression,cardiovascular disease, or hypogonadism (i.e.,low testosterone)."
f8acd1d7-f94a-454b-a544-d23b2a46bdf0,https://examine.com/conditions/male-sexual-dysfunction,Male Sexual Dysfunction,Have any supplements been studied for sexual dysfunction?,"A handful of studies have foundmacato improve sexual desire in people with and without sexual dysfunction. Additionally,cocoa extractmay improve sexual function by supporting vascular health.A number of other supplements have shown some promise (e.g.,fenugreek,yohimbine,tribulus-terrestris,Eurycoma Longifolia Jack), but very little research has been conducted on any of these supplements."
680c82ea-931b-4276-9bb4-b9f3860572a4,https://examine.com/conditions/male-sexual-dysfunction,Male Sexual Dysfunction,How could diet affect sexual dysfunction?,"In individuals who areoverweight, or have diet-related health conditions liketype-2-diabetes, weight loss can markedly improve sexual function.[3]"
ef12028b-b34b-4300-bfb7-22e66042f5bd,https://examine.com/conditions/male-sexual-dysfunction,Male Sexual Dysfunction,Are there any other treatments for sexual dysfunction?,"Regular exercise can improve erectile dysfunction.[3]Psychotherapy and sex therapy are also effective for treating sexual dysfunction, especially if the dysfunction is caused by a person’s beliefs, previous experiences, or perception of themselves.[2]Smoking cessation is probably beneficial for erectile dysfunction.[4][5]If the sexual dysfunction is secondary to another condition, treating that condition may resolve the sexual dysfunction."
bd9f97fd-6a7b-4c00-83a8-f33cb6755e73,https://examine.com/conditions/male-sexual-dysfunction,Male Sexual Dysfunction,What causes sexual dysfunction?,"“Normal” sexual function requires vascular, neurological, hormonal, and psychological systems to function together. As such, issues with any of these symptoms may produce issues with sexual function.[6]Sexual dysfunction can be caused by:Neurological issues (e.g., damage to the brain, the spinal cord, or the nerves of the penis)Vascular issues (e.g., reduced penile blood flow due tocardiovascular disease)Endocrine issues (e.g.,low testosterone, highprolactin, high/low thyroid hormones)Psychosocial issues (e.g.,depression,stress, or relationship issues)[7]Sleep disturbancesMedications (e.g., SSRIs, opioids, certain blood pressure medications)Recreational drugs"
bc3427af-d964-4074-a34d-c7c22cb696e0,https://examine.com/conditions/menopause,Menopause,What is menopause?,"Natural menopause is when menses permanently cease because the ovaries stop producingestrogenandprogesterone. It generally occurs in women after 45 years of age with no pathological or physiological cause, but early menopause can result from surgery, chemotherapy, radiotherapy, orprimary ovarian insufficiency. Perimenopause is the transitional phase into menopause and may last between 4 to 8 years.[1]"
aa3d175f-1a96-42d6-bfce-db5fb5b620a0,https://examine.com/conditions/menopause,Menopause,What are the main signs and symptoms of menopause?,"Hot flashes, night sweats, vaginal dryness,insomnia, trouble focusing, and mood swings are the primary symptoms women experience during the transition into and sometimes throughout menopause. Women can also experience changes inbody composition. The main sign of menopause is a lack of menstruation."
a9d2b954-edee-4056-8bbf-4b4d5baee699,https://examine.com/conditions/menopause,Menopause,How is menopause diagnosed?,"Menopause is clinically diagnosed after 12 months of amenorrhea (lack of mentruation) without other causes, such as surgical removal of the ovaries, chemotherapy or radiotherapy, orprimary ovarian insufficiency. It usually occurs after 45 years of age and is considered abnormal if it occurs prior to 40 years of age. Blood and urine tests can be conducted to detect changes in hormone levels.[2]"
e5d2e90c-e0bb-4841-bb85-60f2f71a9acb,https://examine.com/conditions/menopause,Menopause,What are some of the main medical treatments for menopause?,"For some women experiencing severe hot flashes, night sweats, and vaginal dryness,hormone replacement therapy(HRT) may be prescribed to relieve these symptoms. HRT comes in the form of pills, skin patches, vaginal creams, gels, and rings. HRT is not appropriate for everyone and should be taken in the lowest dose that is effective and for the shortest amount of time needed.[3]While HRT was previously considered a standard therapy, it is increasingly cautioned against due to the known risk of blood clots and cancer with long-term use."
73c7f7c0-683f-467d-a6d2-86574045504c,https://examine.com/conditions/menopause,Menopause,Have any supplements been studied for menopause?,"A number of botanical and other nutritional supplements have been investigated for the treatment of menopausal symptoms.Black cohosh, red clover,omega-3 fatty acids,dehydroepiandrosterone,evening primrose oil,Vitex agnus-castus,soy isoflavonesandSt. John's wortare among the variety of supplements purported to reduce menopausal symptoms."
7dd74bb9-35a6-4bc9-b5d4-793db8220440,https://examine.com/conditions/menopause,Menopause,How could diet affect menopause?,"Hormone changes during menopause can negatively affect lipid and glucose metabolism. TheAmerican Heart Associationrecommends women consume a diet rich in fruits, vegetables, high-fiber whole grains, and oily fish, and that they limitsaturated fat,cholesterol,alcohol, sodium, andsugarand avoid trans-fatty acids."
e142db8d-5e41-40a0-9f51-14c375db1fbf,https://examine.com/conditions/menopause,Menopause,Are there any other treatments for menopause?,"Exercise likeyogamay be particularly helpful for vasomotor and psychological symptoms.[4]Strength andresistance trainingare especially important for maintaining muscle mass and bone mineral density, especially when combined with high-impact exercises like jumping, skipping, and jogging.[5]"
9a9ca427-fd30-45c2-a0f2-4277013f32bd,https://examine.com/conditions/menopause,Menopause,What causes menopause?,"Menopause is a natural condition that occurs as women age. Over time, a woman’s ovarian follicles and granulosa cells diminish. Given these cells are the main producers of estradiol and inhibin[6](a hormone that tells the pituitary gland to make lessfollicle-stimulating hormone), the body’s hormonal balance shifts toward lowerestrogenandprogesteronelevels and increased follicle-stimulating hormone and luteinizing hormone levels. This hormonal profile results in irregular menstrual cycles, which ultimately stop altogether."
1062fd0a-53f1-4e38-95f0-a4e1408af5da,https://examine.com/conditions/mild-cognitive-impairment,Mild Cognitive Impairment (MCI),What is mild cognitive impairment?,"Mild cognitive impairment(MCI) describes a condition where people have poorermemoryand thinking skills compared to other people their age but with minimal effects on typical daily tasks. This is sometimes caused byreversiblefactors like medication side effects,alcohol, poor sleep, and head injuries. But mild cognitive impairment is also the earliest detectable sign of the progressive cognitive decline associated with forms ofdementia, includingAlzheimer’s disease. Therefore, it is an important condition to detect to prevent the cognitive impairments from becoming sufficient to impair a person’s independence and ability to perform typical daily tasks.[1][2][3]"
2e14edc1-4a29-4496-8dfb-58b8ab103ff3,https://examine.com/conditions/mild-cognitive-impairment,Mild Cognitive Impairment (MCI),What are the main signs and symptoms of mild cognitive impairment?,"People with mild cognitive impairment may lose things with increasing regularity, find it hard to make decisions and judgments, or notice increasing difficulty with language and remembering appointments and recent events. These symptoms are often also noticed by their friends and family. People with such symptoms should ask their doctor to test for signs that help identify the cause. This is important because some causes of mild cognitive impairment are unrelated todementiaand are treatable.[3][4][2]The signs of mild cognitive impairment include impaired memory, poor task completion, impaired nerve reflexes, and problems with movement, coordination, and balance.[3][4][2]"
bcf26b5d-b5b1-4843-9981-2e783e2866a2,https://examine.com/conditions/mild-cognitive-impairment,Mild Cognitive Impairment (MCI),How is mild cognitive impairment diagnosed?,"The factors that can cause poor memory and thinking skills but are unrelated todementia(e.g., medications,alcohol, poor sleep, and head injuries) are first ruled out with a medical history. The subsequent diagnosis of mild cognitive impairment involves several steps. Cognitive, neurological, and physical function tests are used to confirm poor memory and thinking skills and to identify problems with movement, coordination, and balance. Additional diagnostic tests may also be used to identify possible causes. For example, brain imaging tests likemagnetic resonance imaging(MRI) orpositron emission tomography(PET) can detect abnormalities in brain structure, while biochemical tests can detect abnormalities intauandbeta-amyloidprotein levels in thecerebrospinal fluid(CSF).[3][4][2][5]"
4def39e8-8a04-4221-9240-66239329f109,https://examine.com/conditions/mild-cognitive-impairment,Mild Cognitive Impairment (MCI),What are some of the main medical treatments for mild cognitive impairment?,"Thereversiblecauses of mild cognitive impairment (e.g., medication side-effects,alcohol, poor sleep, and head injuries) can often be treated by addressing those factors directly. For mild cognitive impairment associated withdementia(including Alzheimer's disease), there are no current pharmacological treatments.[6][2][5]Instead, strategies are used to help people with mild cognitive impairment improve their cognitive function and maintain independence in performing their typical daily tasks. These strategies include maintaining regular physical and cognitive activities and social interactions.[2][5][7]But more evidence is needed to determine their efficacy for preventing dementia.[2][5][8]"
7a572bc9-0ec6-43db-bb10-b05a80ad790a,https://examine.com/conditions/mild-cognitive-impairment,Mild Cognitive Impairment (MCI),Have any supplements been studied for mild cognitive impairment?,"The effects of several supplements have been studied in people with mild cognitive impairment. These includeomega-3 fatty acids,probiotics,ginkgo biloba,B vitamins,vitamin C,vitamin D,vitamin E, etc. However, the current evidence does not support the use of any supplement in people with mild cognitive impairment for improving cognitive function or preventing dementia.[9][10][11][12]That said, the current evidence is limited, and more high-quality large-scale randomized controlled trials are needed to make definitive conclusions."
d1e82c8e-9a18-4318-be37-fe211c6dd6c5,https://examine.com/conditions/mild-cognitive-impairment,Mild Cognitive Impairment (MCI),How could diet affect mild cognitive impairment?,"Evidence suggests that higher circulating concentrations ofmethionine cyclemetabolites (homocysteine, methionine, and S-Adenosylmethionine) are associated with greater cognitive decline in people with mild cognitive impairment.[13]Sincefolateandvitamin B12regulate methionine metabolism and can reduce plasma homocysteine concentrations,[14]it is possible that their intake may influence cognitive decline. However, while lower folate and B12 concentrations are associated with poorer cognitive function,[15][16][17]current evidence does not show that dietary folate or vitamin B12 intake prevents or treats mild cognitive impairment.[18][9][10]Other cohort studies show that consuming amediterranean diet[19][20]and a higher dietary intake ofomega-3 fatty acids[21]are associated with a lower risk of mild cognitive impairment. Long-duration randomized controlled trials are needed to prove the causality of these associations."
ae71a3e9-fe17-432e-b073-4fa0e63b9502,https://examine.com/conditions/mild-cognitive-impairment,Mild Cognitive Impairment (MCI),Are there any other treatments for mild cognitive impairment?,"While all types of exercise improve cognitive function in people with mild cognitive impairment[22][23], resistance exercise appears most likely to prevent further cognitive decline.[24]However, the efficacy of exercise in reducing the risk of dementia is currently unclear.[25][26]Transcranial direct current stimulation(electrically stimulating specific brain regions) can improve memory and cognitive skills in people with mild cognitive impairment.[27][28][29]However, larger and higher-quality randomized controlled trials are needed to determine whether it can prevent or delay cognitive decline.Computer or app-basedcognitive trainingmay also improve cognitive function in people with mild cognitive impairment. But, the current evidence is equivocal and higher-quality studies are needed.[30][31]Recently, drugs that reduce brain beta-amyloid accumulation (lecanemab, aducanumab, etc) have improved some aspects of cognitive function in people withearly-stageAlzheimer's disease.[32][33][34]Other drugs (memantine, donepezil, etc) are also sometimes used to treat symptoms in people with dementia.[35][36]However, the safety and efficacy of these drugs have yet to be tested in people with mild cognitive impairment."
ab1eaf17-bef4-4bac-bf51-75b509d670af,https://examine.com/conditions/mild-cognitive-impairment,Mild Cognitive Impairment (MCI),What causes mild cognitive impairment?,"The causes of mild cognitive impairment can include the side effects of medications,alcohol, sleep deprivation, head injuries, and some neurological/psychiatric disorders. But mild cognitive impairment is also found in the early stages of neurodegenerative diseases like forms ofdementia, includingAlzheimer’s disease.[1][2][3]The exact cause of mild cognitive impairment associated with dementia and Alzheimer’s disease is unknown, but the risk factors include advanced age and diabetes.[2][37]A family history of dementia or Alzheimer's disease also increases risk, suggesting that inherited genetic traits play a role. For example, people with the APOE-ε4 variant in the gene coding apolipoprotein E have a greater risk of developing mild cognitive impairment.[38]"
58fc2880-c2a1-4c5b-8f3a-0b5e5075144f,https://examine.com/conditions/nonalcoholic-fatty-liver-disease,Nonalcoholic Fatty Liver Disease (NAFLD),What is NAFLD?,"Nonalcoholic fatty liver disease(NAFLD) refers to a spectrum of liver diseases characterized by an excessive accumulation of fat in the liver without excessive alcohol consumption (i.e., > 21 standard drinks per week for men and > 14 standard drinks per week for women). It can be broadly divided intononalcoholic fatty liver(NAFL) andnonalcoholic steatohepatitis(NASH). NAFL is less severe and only includes excessive liver fat (i.e., the presence of fat in > 5% of liver cells), whereas NASH includes excessive liver fat plus liver inflammation and damage."
4be77fc1-1c15-46cb-9272-f447fe596a93,https://examine.com/conditions/nonalcoholic-fatty-liver-disease,Nonalcoholic Fatty Liver Disease (NAFLD),What are the main signs and symptoms of NAFLD?,"Most people with NAFLD do not present with symptoms, and the disease remains silent until it has progressed to an advanced stage. In the early stages, fatigue and upper abdominal pain may be reported. Elevated levels of serum alanine aminotransferase and aspartate aminotransferase are also typically observed. In cases of very severe NAFLD, jaundice (i.e., yellowing of the eyes and skin), edema, ascites (i.e., excess fluid trapped in the abdomen), and/orconfusionmay be present."
18296be8-f8f9-4060-a5ff-dcde87601e1d,https://examine.com/conditions/nonalcoholic-fatty-liver-disease,Nonalcoholic Fatty Liver Disease (NAFLD),How is NAFLD diagnosed?,"Liver biopsy is considered the gold standard for diagnosing NAFLD and is essential for diagnosing NASH, as it is the only procedure that can reliably differentiate it from NAFL.[1]Imaging methods, such as ultrasound,computed tomography(CT), and magnetic resonance imaging (MRI), are more commonly used, but their ability to detect mild NAFL is poor. MRI seems to be the precise imaging method.[2]"
2b2b66f6-c85b-4461-be57-c03db3f90645,https://examine.com/conditions/nonalcoholic-fatty-liver-disease,Nonalcoholic Fatty Liver Disease (NAFLD),What are some of the main medical treatments for NAFLD?,"There are no Food and Drug Administration-approved medications for treating NAFLD. Current guidelines suggest that pharmacological treatment should be reserved for people with biopsy-proven NASH.[3]Off-label medications are mainly used for treating risk factors (i.e.,obesity,insulin resistance,hypertension,dyslipidemia) with the aim of preventing disease progression."
4226c6bb-bda1-4fcd-a4bc-1c78d0a5e155,https://examine.com/conditions/nonalcoholic-fatty-liver-disease,Nonalcoholic Fatty Liver Disease (NAFLD),Have any supplements been studied for NAFLD?,Vitamin Eseems to be the most compelling supplement for treating NAFLD.[4]There is evidence to support the use of omega-3 polyunsaturated fatty acids as well.[5]
038608f3-5e81-4072-ae20-ec4a1746fea5,https://examine.com/conditions/nonalcoholic-fatty-liver-disease,Nonalcoholic Fatty Liver Disease (NAFLD),How could diet affect NAFLD?,"Lifestyle modification with the aim of inducing weight loss is the cornerstone of NAFLD treatment. A weight loss of at least 5% of initial body weight is effective for reducing liver fat, and a weight loss of 7–10% can improve features of NASH.[3]In this respect, the macronutrient composition of the diet is much less important than the energy content; an array of dietary patterns can be effective as long as they facilitate sustained weight loss."
992d3350-a02a-4ebc-9a10-bf1e2fa6ece9,https://examine.com/conditions/nonalcoholic-fatty-liver-disease,Nonalcoholic Fatty Liver Disease (NAFLD),Are there any other treatments for NAFLD?,An increase in physical activity is recommended alongside dietary changes to achieve significant weight loss.[1][3]Exercise can also decrease liver fat irrespective of changes in body weight.[6]
dc8ff75d-6a5e-4e7d-a51c-8b14ede2cc07,https://examine.com/conditions/nonalcoholic-fatty-liver-disease,Nonalcoholic Fatty Liver Disease (NAFLD),What causes NAFLD?,"NAFLD reflects an imbalance of energy metabolism in the liver: more energy enters the liver than it can dispose of, resulting in a net accumulation of energy astriglycerides.[7]Overnutrition and sedentary behavior primarily lead to the development of NAFLD, but there are a variety of other factors that further influence the development and progression of the disease, including genetics, aging, fat tissue dysfunction, gut dysbiosis, andinsulin resistance.[8][9]"
082c3c01-f5cc-4c57-b998-33e7c22802ff,https://examine.com/conditions/osteoporosis,Osteoporosis,What is osteoporosis?,"Osteoporosis is a disease that thins and weakens the bones. Bones become fragile and fracture (break) easily, especially the bones in the hip, spine, and wrist. In the United States, millions of people either already have osteoporosis or are at high risk due to low bone mass. Osteoporosis is a silent disease, meaning some people don’t know they have it until a bone is broken.[1]"
db746008-c1aa-463c-9e3e-5bee16bb8d92,https://examine.com/conditions/osteoporosis,Osteoporosis,How is osteoporosis diagnosed?,"Osteoporosis is diagnosed bybone mineral density(BMD) of the spine or hip, which is measured with dual energy x-ray absorptiometry (DEXA) scans. A normal BMD is no more than 1 standard deviation (SD) below the average or reference value.Osteopenia(low bone mass) is 1-2.5 SDs below the reference and osteoporosis is 2.5 SD or more below the reference BMD value.[2]"
