id,url,title,header,text
784f3c7f-50c9-444e-9acb-d5a74faf16ec,https://examine.com/conditions/depression,Depression,What is depression?,"Depression is a state of low mood that can persist for weeks or months.[1]The symptoms of depression interfere with daily life and are often present during adolescence and young adulthood but may not be diagnosed until adulthood. As of 2019,The National Center for Health Statisticsreports that 4.7% of U.S. adults over 18 years of age have regular feelings of depression."
50b6fa34-7f3c-4ccc-a1a2-c05520541c25,https://examine.com/conditions/depression,Depression,What are the main signs and symptoms of depression?,"The symptoms of depression vary widely, such as sleeping too much or too little. This is one reason why diagnosing depression can be a challenge. Other symptoms include lost interest in favorite activities, feeling hopeless, and under-or overeating.[1]Symptoms may also vary by sex. For example, men with depression report higher rates of anger, aggression, substance use, and risk-taking compared to women.[2]"
8395dbb3-eaed-4368-8155-07a291b97932,https://examine.com/conditions/depression,Depression,How is depression diagnosed?,"Depression is diagnosed by a healthcare provider who usually uses questionnaires that assess symptom severity. For more information on diagnosing depression, please refer to the American Psychiatric Association.[3]"
deb72a61-4e9a-4429-a5fe-1492433632f2,https://examine.com/conditions/depression,Depression,What are some of the main medical treatments for depression?,"Today, antidepressants (chiefly SSRIs and SNRIs) are still the first-line treatment for depression, but their effects vary across individuals, so one may need to try different antidepressants to find the correct one.[1]Talk therapy is usually used in conjunction with antidepressants. If antidepressants fail to improve symptoms, brain stimulation therapies such as electroconvulsive therapy and transcranial magnetic stimulation can be effective tools for medication-resistant depression.[4]"
aadee395-190c-44cc-a6ab-fc10a0c6052a,https://examine.com/conditions/depression,Depression,How could diet affect depression?,"It appears that aMediterranean dietor a diet consisting of foods with a low Dietary Inflammatory Index (DII) has been associated with a reduced risk of depression.[5]However, more research is needed before a specific diet can be recommended. With that being said, current research suggests that improving one's diet by replacing ""junk"" foods with nutrient-dense, higher fiber foods, such asvegetables, fruits, whole grains, andnutsreduce the risk and symptoms of depression.[6]"
1d1550ee-109b-4d0e-8dc8-994ce0cfc6e6,https://examine.com/conditions/depression,Depression,Have any supplements been studied for depression?,"If you are using an antidepressant, consult your physician before taking any supplement, as cases of harmful interactions between certain supplements and antidepressants have been reported (e.g., between S-Adenosylmethionine and clomipramine[7]).With that in mind, several supplements and herbal remedies have been examined for depression includingfish oil,saffron,curcumin, andzinc. Note thatSt. John’s Wortcan adversely interact with many pharmaceuticals, including some antidepressants."
914ed62d-469d-4d6b-86ab-c68488581f5a,https://examine.com/conditions/depression,Depression,Are there any other treatments for depression?,"Although alternative treatments such asacupuncture, herbal medicines, andmeditationare commonly used for depression, it is not recommended to usealternative medical treatmentswithout seeking approval from a healthcare professional."
7af530d0-7d24-402d-92bd-e1b3b3701bd1,https://examine.com/conditions/depression,Depression,What causes depression?,"The causes of depression are complex, including prenatal factors, genetics, environment, biology, age, and sociocultural and psychological factors.[8]"
74721664-b4ba-475c-8dc9-d07177048c42,https://examine.com/conditions/premenstrual-syndrome,Premenstrual Syndrome (PMS),What is PMS?,"Premenstrual syndrome, or PMS, is a group of symptoms that start one to two weeks before menstruation. Most women have at least some symptoms of PMS, and the symptoms go away after their periods start. For some women, the symptoms are severe enough to interfere with their lives, which is a type of PMS calledpremenstrual dysphoric disorder(PMDD).[1]"
50b1fc68-a4e1-434e-808c-628dede9cf8c,https://examine.com/conditions/premenstrual-syndrome,Premenstrual Syndrome (PMS),What are the main signs and symptoms of PMS?,"Common PMS symptoms are as follows:[1]Breast swelling and tendernessAcneBloatingandweight gainHeadache orjoint painFood cravingsIrritability, mood swings, crying spells,depression"
2aeed64c-4866-48f4-ab15-10f05eacfa7f,https://examine.com/conditions/premenstrual-syndrome,Premenstrual Syndrome (PMS),How is PMS diagnosed?,"PMS is usually diagnosed if at least one of the symptoms listed above occurs during the five days before the start of menses for at least three cycles, two of which must be consecutive cycles. Additionally, these symptoms stop at least four days after the onset of menses and do not recur until the next cycle.[2]"
ba3a895c-9321-4fe3-a3b6-c438a3964da7,https://examine.com/conditions/premenstrual-syndrome,Premenstrual Syndrome (PMS),What are some of the main medical treatments for PMS?,"Over-the-counter pain relievers such as ibuprofen, naproxen, or acetaminophen may help ease mild PMS symptoms (e.g., cramps, headaches,breast tenderness). When symptoms of PMS are severe,selective serotonin reuptake inhibitors(SSRIs) such as paroxetine (Paxil), fluoxetine (Prozac), citalopram (Celexa), or sertraline (Zoloft) can be tried. Oral contraceptives have also shown some benefit for reducing PMS symptoms. Theoretically, these work by regulating fluctuations ofestrogenandprogesteronethroughout a cycle.[2]"
bf4fa3e9-bbdb-4c57-9257-555783454204,https://examine.com/conditions/premenstrual-syndrome,Premenstrual Syndrome (PMS),Have any supplements been studied for PMS?,"Dailycalciumsupplements (calcium carbonate) have been shown to reduce symptoms of PMS.Vitamin Dandvitamin B6have also been assessed for PMS symptoms, but there is insufficient evidence to support their use.[2]Many herbs have also been studied, withchasteberryhaving the greatest volume of evidence behind it.[3]"
e15ae83a-3cca-4ca4-8dc6-a231b72f9e18,https://examine.com/conditions/premenstrual-syndrome,Premenstrual Syndrome (PMS),How could diet affect PMS?,"Specific diets have not been studied for PMS. Some observational evidence has found that consuming foods high incalcium,vitamin D,thiamine, andriboflavinhas been associated with a lower risk of PMS.[4][5]Common dietary recommendations for PMS include small and frequent meals as well as reducing consumption ofsalt,caffeine, and refined sugars. These modifications are intended to reduce irritability,insomnia, fluid retention,bloating, and weight gain during PMS.[6]"
b9a1ea85-a295-4702-8306-83b8d0157999,https://examine.com/conditions/premenstrual-syndrome,Premenstrual Syndrome (PMS),Are there any other treatments for PMS?,"Exercise is often recommended for PMS because it can promote endorphin release which can improvemoodand increase energy.[6]Psychological modalities such as cognitive-behavioral therapy (CBT) and other modalities such asacupuncturewith and without herbal medicine have been studied for relieving PMS symptoms. However, more research is needed to determine their benefits.[2]"
1fe6f09a-4581-4621-bf1c-3af7ccb2b945,https://examine.com/conditions/premenstrual-syndrome,Premenstrual Syndrome (PMS),What causes PMS?,"No one knows what causes PMS. It is likely that changes to the levels ofestrogenandprogesteroneand individual sensitivity to these changes trigger PMS symptoms. These hormones affect levels of neurotransmitters such asgamma-aminobutyric acid,dopamine, and serotonin which in turn can affect mood. Some evidence suggests that suppressing estrogen can improve PMS symptoms,[2]and a deficiency of progesterone may worsen symptoms, but more research is needed.[7]"
8a1023ad-71e5-4183-ab50-3155b6e39b88,https://examine.com/conditions/schizophrenia,Schizophrenia,What is schizophrenia?,"Schizophrenia is a severe mental illness that interferes with a person’s thinking and perception of the world around them. Even though schizophrenia affects about 1% of the world's population, it is one of the top 20 causes of disability worldwide.[1][2][3]"
04f106ae-6d9a-403e-8fcb-4e2376217966,https://examine.com/conditions/schizophrenia,Schizophrenia,What are the main signs and symptoms of schizophrenia?,"Symptoms of schizophrenia are broken down into two main categories:Positive symptoms — experiences thataddto existing emotions or thoughts — such as hallucinations, delusions, and disordered thinking.Negative symptoms — experiences thatsubtractfrom emotions or thoughts — such as reduced speech, lack of motivation, and decreased emotional expression.Catatonia, which is characterized by repetitive non-goal directed movements, unresponsiveness, and episodes of overactivity or immobility, is another common symptom of schizophrenia. Additionally, cognitive impairment, which can affect things like memory, processing speed, and attention, has recently been recognized as a symptom of schizophrenia. Symptoms of schizophrenia usually begin to appear between the ages of 16 and 30.[4][1]"
5f53565d-543a-4b48-8279-ac1393622af6,https://examine.com/conditions/schizophrenia,Schizophrenia,How is schizophrenia diagnosed?,"A healthcare provider will complete an evaluation to rule out other potential causes of the symptoms. Two sets of criteria, from theDiagnostic and Statistical Manual of Mental Disorders(DSM), published by the American Psychiatric Association, and theInternational Classification of Disease(ICD), published by the World Health Organization. may be used to diagnose schizophrenia."
ab8d5dad-d32f-4694-b604-b64c5d72a161,https://examine.com/conditions/schizophrenia,Schizophrenia,What are some of the main medical treatments for schizophrenia?,"Antipsychotic medications are the most effective treatments for schizophrenia. They are usually taken orally, but can be injected intramuscularly in urgent situations. However, these medications are associated with unpleasant side effects such as weight gain, sedation, and extrapyramidal symptoms (uncontrollable involuntary movements).[4]⚠️Caution:Look out for extrapyramidal symptomsWhen taking antipsychotic medications, it is important to monitor for extrapyramidal symptoms such as lip smacking, rapid blinking, or other involuntary movements. Although very rare, these may be a sign of a syndrome called Tardive Dyskinesia. It can be dangerous if the symptoms affect the larynx, causing breathing difficulties."
a147051a-2bba-4325-846f-1dd66d4c0655,https://examine.com/conditions/schizophrenia,Schizophrenia,Have any supplements been studied for schizophrenia?,"D-serine,sarcosine, andGinkgo bilobahave been shown to be effective at reducing symptoms of schizophrenia when used as adjunctive treatments to antipsychotic medications.A meta-analysis of randomized controlled trials found that, when used as an adjunct to antipsychotics, B vitamins, specificallyVitamin B6,Vitamin B12, andFolic Acid, were able to reduce total psychiatric symptoms in people with schizophrenia. However, the results were highly variable, and it was not entirely clear which specific vitamins or amounts determined the effect.[5]"
5e004343-7bad-43f3-bf73-9b081c9e1580,https://examine.com/conditions/schizophrenia,Schizophrenia,How could diet affect schizophrenia?,"There is limited evidence that dietary changes might affect schizophrenia. The Dietary Inflammatory Index (DII) is a metric used to assess the inflammatory potential of a dietary pattern. A higher DII score is associated with a more inflammatory diet. A small observational study found that people with schizophrenia are more likely to follow a dietary pattern with a high DII score.[6]Some trials also found that a gluten-free diet reduced symptoms of schizophrenia. However, additional trials failed to find the same result.[7]"
625e5997-c2ed-409b-b408-b378e8d507cb,https://examine.com/conditions/schizophrenia,Schizophrenia,Are there any other treatments for schizophrenia?,"Psychotherapy, specifically cognitive behavioral therapy, is often used with medication. Electroconvulsive therapy may also be beneficial for people with schizophrenia.[4][8]"
03c65c96-4e70-41fd-b0d7-ef21ad05f698,https://examine.com/conditions/schizophrenia,Schizophrenia,What causes schizophrenia?,"There have been numerous proposed hypotheses regarding the cause of schizophrenia. However, the exact cause is unknown. It does appear that genes, environmental factors, and neurotransmitter imbalances may all be involved.[4]"
010433d4-814a-40e9-b31c-643fd76112d1,https://examine.com/categories/muscle-gain-exercise/,Muscle Gain & Exercise,How does muscle gain work?,"Muscle tissue is constantly turning over, with the rates ofmuscle protein synthesis(MPS) andmuscle protein breakdown(MPB) fluctuating throughout the day. Net protein balance is the difference between MPS and MPB. For an increase in muscle mass to occur, MPS must exceed MPB, resulting in a positive net protein balance.[1]MPS is very sensitive to exercise and diet (namely, essential amino acid intake)."
67b24c39-4164-4ecf-b405-4f699a0e929c,https://examine.com/categories/muscle-gain-exercise/,Muscle Gain & Exercise,How could diet affect exercise and muscle gain?,"An adequate energy intake is essential to optimize exercise performance and adaptations — if one maintains an energy-deficient diet during training, muscle loss, impaired recovery, illness, decreased bone mineral density, poor mood, and menstrual dysfunction can occur.[2]Consuming a hypercaloric diet augments resistance-training-induced increases in muscle mass.[3]Beyond general energy intake, carbohydrate intake is important because it serves as a primary fuel source over a wide range of exercise intensities, and a robust body of evidence demonstrates that matching carbohydrate availability to exercise demands enhances both prolonged endurance exercise and intermittent high-intensity exercise performance.[4]Additionally, dietary protein intake is essential for the synthesis and repair of muscle tissue and is required after exercise to elicit a positive net protein balance.[5]"
f106b1af-caf7-42f1-99f8-32fc99393ce2,https://examine.com/categories/muscle-gain-exercise/,Muscle Gain & Exercise,Which supplements are of most interest for exercise and muscle gain?,"Supplements may benefit exercise performance and muscle gain by providing a convenient form of energy and nutrients (e.g., powdered proteins such aswhey proteinor vegetable protein sources, carbohydrate drinks and gels), correcting or preventing nutrient deficiencies, improving recovery from exercise, or enhancing exercise performance directly.[6]The supplements of most interest for enhancing exercise performance directly arecreatine,caffeine,nitrate,citrulline,beta-alanine, andsodium bicarbonate.[6]"
9055ee1f-f42f-4846-932b-1e8cd635287d,https://examine.com/conditions/delayed-onset-muscle-soreness,Delayed Onset Muscle Soreness (DOMS),What is DOMS?,Delayed Onset Muscle Soreness(DOMS) is muscle soreness that occurs 12–24 hours after performing an unfamiliar exercise or exercising with increased intensity or duration. It does not cause pain during exercise.
0c9118df-0a23-464a-be94-76dfa18fd7c2,https://examine.com/conditions/delayed-onset-muscle-soreness,Delayed Onset Muscle Soreness (DOMS),What are the main signs and symptoms of DOMS?,"People typically experience muscle weakness, swelling, stiffness, and tenderness 12–24 hours after exercise, lasting up to 5–7 days. Depending upon the exercise's novelty, duration, and intensity, symptoms can range from mild to moderate."
1d809a65-bbe3-476b-b414-9e4857a9784c,https://examine.com/conditions/delayed-onset-muscle-soreness,Delayed Onset Muscle Soreness (DOMS),How is DOMS diagnosed?,"There are no tests to diagnose DOMS. A healthcare provider will instead conduct a thorough examination to rule out other possible causes of symptoms, such as rhabdomyolysis, compartment syndrome, or muscle strains. If the assessment indicates a condition other than DOMS, blood tests or imaging may be performed for further evaluation.[1][2]"
aa39d25c-ac2d-4e93-a990-713cd0448a4f,https://examine.com/conditions/delayed-onset-muscle-soreness,Delayed Onset Muscle Soreness (DOMS),What are some of the main medical treatments for DOMS?,"Usually, DOMS does not require medical treatment. With rest and/or lowering the intensity of exercise, symptoms should subside within 5–7 days. Acetaminophen or oral and/or topical nonsteroidal anti-inflammatory drugs may decrease soreness; however, prolonged use of these medications is not recommended.[3][4]"
c3e54a35-a6ae-4e2d-b965-8278e22da898,https://examine.com/conditions/delayed-onset-muscle-soreness,Delayed Onset Muscle Soreness (DOMS),Have any supplements been studied for DOMS?,"Curcumin,Branched-Chain Amino Acids,Tart Cherry Juice,Fish Oil,Taurine,Vitamin C, and Beet Root may be helpful for treating the symptoms of DOMS. However, there is mixed evidence regarding the efficacy ofdietary supplements for DOMS.[5]Furthermore, because DOMS will resolve without treatment, using dietary supplements may not be worth the potential risks associated with dietary supplements, such as potential drug interactions or unlisted ingredients."
a2908314-33d9-4b93-8020-9e7291d5f04e,https://examine.com/conditions/delayed-onset-muscle-soreness,Delayed Onset Muscle Soreness (DOMS),How could diet affect DOMS?,"One study comparing the effects of a high and low carbohydrate meal on DOMS found no difference between the two groups.[6]Thus, if an individual is experiencing DOMS, it is best to follow the basics of recovery from exercise (i.e., adequate fluids, calories, protein, and sleep).[7]"
017b93de-6013-4837-b233-c94298ca2fff,https://examine.com/conditions/delayed-onset-muscle-soreness,Delayed Onset Muscle Soreness (DOMS),Are there any other treatments for DOMS?,"Massage,[8]compression garments,[9]cold therapy,[10]local heat pack therapy,[10]vibration therapy,[11]and intermittent compression therapy[12]have mild to moderate effects in reducing DOMS. However, popular recovery tools such as saunas,[10]stretching,[13]and acupuncture[14]have not been found to be effective in treating DOMS."
51e06b6d-558f-482a-a236-0a932cac9cce,https://examine.com/conditions/delayed-onset-muscle-soreness,Delayed Onset Muscle Soreness (DOMS),What causes DOMS?,"Although the exact mechanism of DOMS hasn’t been determined, DOMS tends to occur after eccentric (muscle-lengthening) or novel exercises. Other factors, such as muscle damage, neutrophil accumulation, oxidative stress, inflammatory compounds (histamine, bradykinins, and prostaglandins), and fluid accumulation may also contribute to the symptoms of DOMS.[2]However, if a person performs an exercise that causes DOMS, they may feel less sore when they perform the same exercise during future workouts; this is known as the repeated bout effect.[15]"
68e352f4-ab3a-4266-aaf8-aa45ad249b42,https://examine.com/conditions/muscle-cramps,Muscle Cramps,What are muscle cramps?,"Muscle cramps are involuntary muscle contractions that may last anywhere from a few seconds to a few minutes. They usually happen suddenly and can be very painful. The cramp can often be seen, and the affected muscle may be hard to the touch. While muscle cramps can be associated with certain serious conditions, this is rare.[1]There are several types of muscle cramps. In active individuals, cramps are termedexercise associated muscle cramps(EAMC). Muscle cramps in the legs or feet in bed are often termed rest cramps, or nocturnal leg cramps.[1]"
2644b847-ef72-41ad-b1e5-81343f3a294c,https://examine.com/conditions/muscle-cramps,Muscle Cramps,What are the main signs and symptoms of muscle cramps?,"The main symptom of a muscle cramp is a sudden, involuntary, and painful contraction of a muscle.[1]Unfortunately, the cramp can still cause pain after it is over, even for days.[2]Muscle cramps can be felt as hardness of the affected muscle, and may be seen depending on muscle location and individual variability.[1]While muscle cramps are commonly believed to be caused by dehydration or electrolyte imbalances, they are more likely due to muscle fatigue and nerve dysfunction.[3][4][4]PMID:33998664]"
7a9643c6-dd22-49c5-9444-eb7eb398f60e,https://examine.com/conditions/muscle-cramps,Muscle Cramps,How are muscle cramps diagnosed?,"A clinical diagnosis of muscle cramps is made based on the presence of common symptoms and triggers. Symptoms are sudden muscle contraction with pain. The muscle contraction can be felt as hardness to the touch, and may also be seen in certain patients. There are various triggers that can set things off, depending on the kind of muscle cramp.Exercise associated muscle cramps(EAMC) can occur after vigorous exercise (often endurance-based), usually in a muscle that was just worked out. Another characteristic of muscle cramps is that they can occur when attempting to contract a muscle already at its shortest length. Muscle cramps can also occur at rest, or after a trivial movement, especially when the muscle is relaxed and shortened.[2][4]"
d4a48683-6e31-4224-b534-a8a8a58d0bae,https://examine.com/conditions/muscle-cramps,Muscle Cramps,What are some of the main medical treatments for muscle cramps?,"Drugs are not recommended as first line treatment of routine muscle cramps. Muscle cramps can be often relieved by stretching of the affected muscle or massage.[5]Stretching the muscle for 10 to 20 seconds, followed by 20 to 30 minutes of passive tension on the muscle (i.e., keeping the muscle lightly stretched but in a comfortable relaxed position), and then by rest, is often effective after the initial muscle contraction has subsided (in order to prevent further cramping).[4]"
3dcae4ea-043c-4f76-8843-f7d022599012,https://examine.com/conditions/muscle-cramps,Muscle Cramps,Have any supplements been studied for muscle cramps?,"There is limited evidence for supplementation for the treatment of muscle cramps.Magnesiumhas been found to be ineffective for preventative use of muscle cramps in the elderly, and has mixed results in pregnancy.[1][6][7][8]One small trial of a B complex supplement containing 50 mg of fursultiamine (a derivative ofThiamine), 250 µg hydroxocobalamin (vitamin B12a), 30 mg of pyridoxal phosphate (the active form ofvitamin B6), and 5 mg ofriboflavinshowed 86% remission rate of muscle cramps in nocturnal leg cramps in elderly patients withhypertension. However, completion rate and compliance were not discussed in the study.[9]Another small study found a B complex (100 mgthiamine, 40 mgpyridoxine) effective in reducing muscle cramp frequency and intensity in pregnant study participants.[10]Calcium and vitamin D supplementation (both together and alone) have been studied for leg cramps in pregnancy, but they were not found to be consistently effective at reducing cramping.[11]"
98be51d8-ed52-4132-8126-8d57d23ab96e,https://examine.com/conditions/muscle-cramps,Muscle Cramps,How could diet affect muscle cramps?,"While dehydration and electrolyte abnormalities are one hypothesis for the cause of muscle cramps, the overall weight of the evidence suggests otherwise. For example, one trial of Ironman triathletes found no significant differences in post-race body mass losses (i.e., dehydration) and serum electrolytes in those with and without cramps.[3]If cramps were based on system-wide hydration and electrolytes, there is no compelling explanation of how spasms happen in specific muscles. Instead, epidemiologic, animal, and electromyogram data indicate that cramps are more likely due to abnormal muscular control in the spine.[12][4]If an individual does find that their muscle cramps are improved by hydration and electrolytes, diet is a strong way to apply these therapies. For example, consumption of water-dense fruits for hydration, salt for sodium (caution to those with hypertension), dairy for calcium, and various vegetables, fruits and/or for potassium and magnesium.Otherwise, focus on rest is important to relieve EAMC.[4]Diet-wise this means focusing on consuming the appropriate daily amounts of meals of carbohydrates, proteins, and fats for a person’s activity level."
5b5c4f54-a8c8-4f4d-abaf-568894e6f203,https://examine.com/conditions/muscle-cramps,Muscle Cramps,Are there any other treatments for muscle cramps?,"High-quality evidence shows that quinine derivatives, which are often used to treat parasitic infections like malaria, can benefit cramps. However, they are no longer recommended due to their potential for toxicity. There is also some potential for adverse reactions with quinine drinks such as tonic water , even though the dose of quinine in tonic water (40-80 mg/L) is much lower than the therapeutic dose for muscle cramps (200-300 mg daily).[13]Lower-quality evidence shows that nafronyl, calcium channel blockers such as diltiazem, and lidocaine may have some impact on muscle cramps.[14]IVs of magnesium, calcium, and even diazepam (also known as valium) have been used to treat severe forms of cramping, but this is cautioned against due to potential complications such as hypotension or respiratory depression.[4]Hydration and electrolyte drinks are frequently given as a treatment for muscle cramps, though the causative role of dehydration and electrolyte deficiency deficiency in muscle cramps remains controversial.[4]"
