id,url,title,header,text
39cb6998-e69d-46ae-a1d3-847f2d05e920,https://examine.com/conditions/diabetic-neuropathy,Diabetic Neuropathy,What are the main signs and symptoms of diabetic neuropathy?,"Diabetic neuropathies have severalnon-specificsigns and symptoms that are also caused by other conditions. Therefore, diabetic neuropathy can go undiagnosed and untreated.
Symptoms include numbness and tingling (paresthesia) in the fingers and toes, pain in the lower legs and feet, foot ulcers, lightheadedness/dizziness when standing up, erectile dysfunction, and gastrointestinal issues such as nausea, bloating, heartburn, diarrhea, and constipation.[1][2]The signs are revealed with diagnostic tests showing poor nerve function (e.g., inability to sense a pinprick), impaired sensations (e.g., inability to distinguish hot from cold), orthostatic hypotension (a drop in blood pressure when standing up), resting tachycardia (high resting heart rate), and delayed gastric emptying (gastroparesis).[1][2]"
1f1d160a-d437-4c9d-bc3c-dc6ea2faf2af,https://examine.com/conditions/diabetic-neuropathy,Diabetic Neuropathy,How is diabetic neuropathy diagnosed?,"People who’ve hadtype 1 diabetesfor at least five years, and all people withtype 2 diabetes, are typically assessed annually for diabetic neuropathies.[1][2]Assessment includes clinical tests exploring a person’s sensations of vibration, thermal changes, and pain.[1][2]But, since diabetic neuropathies are a collection of several conditions with non-specific signs and symptoms, and sincenondiabetic neuropathies can also occur in people with diabetes, the diagnosis of diabetic neuropathy is a process of exclusion — i.e., alternative causes of the presenting signs and symptoms are systematically ruled out before a final diagnosis."
01456626-4e3a-455b-8f13-8ec3d5ad1ef5,https://examine.com/conditions/diabetic-neuropathy,Diabetic Neuropathy,What are some of the main medical treatments for diabetic neuropathy?,"There are no specific treatments for nerve damage, but lowering hyperglycemia (persistently high blood glucose concentrations) reduces the risk of diabetic neuropathy.[3][4][5]Therefore, the main treatment is to improve blood glucose control using lifestyle behavior change (diet, exercise, and weight management counseling) and glucose-lowering drugs.[1][2]Since diabetic neuropathies can impair sensation, healthcare providers regularly examine patients’ feet for signs of damage to help preventdiabetic foot ulcers. To treat pain associated with diabetic neuropathies, pain-reducing medications (e.g., pregabalin or duloxetine) are used to improve quality of life.[6][7]Reducing pain also helps patients increase their levels of daily physical activity, which improves blood glucose control.[8]"
08e9ebdf-e539-4fc2-9893-d29ee56e1173,https://examine.com/conditions/diabetic-neuropathy,Diabetic Neuropathy,Have any supplements been studied for diabetic neuropathy?,"Yes, research has examined the effects of several supplements on diabetic neuropathy. These includevitamin D,vitamin B12,L-carnitine,alpha-lipoic acid(ALA), and more.[9][10][11][12][13][14]However, additional high-quality randomized controlled trials are needed to make firm conclusions concerning the effectiveness of supplements in reducing the risk of diabetic neuropathy or relieving its symptoms (e.g., pain)."
cfca0aaa-8d1e-492a-9cae-620a4e9d34b0,https://examine.com/conditions/diabetic-neuropathy,Diabetic Neuropathy,How could diet affect diabetic neuropathy?,"Lifestyle behavior change improves blood glucose control in people with diabetic neuropathies.[1][2]This includes an individualized diet to help patients lose weight and minimize postprandial (after-meal) rises in blood glucose concentrations.Specific micronutrients might also play a role. For example, deficiencies invitamin D[15][16][17][18]andvitamin B12[19]are associated with an increased risk of diabetic neuropathy. Therefore, people with diabetes who don’t consumevitamin D-containing foods (oily fish, egg yolks, liver, etc.), or who eat aplant-based dietthat excludes meat,mightbe at a greater risk of diabetic neuropathy. However, studies are needed to test these hypotheses."
128381ce-a92f-4570-9a0b-bd409f2f82e2,https://examine.com/conditions/diabetic-neuropathy,Diabetic Neuropathy,Are there any other treatments for diabetic neuropathy?,"Aerobic exerciseand sensorimotor training to improve motor control (balance, posture, etc.) can relieve some of the signs and symptoms of diabetic peripheral neuropathy.[20]Furthermore, low-frequency electrical stimulation of the spinal cord (also known as neuromodulation therapy) can reduce pain associated with diabetic neuropathies.[21][22]However, more high-quality randomized controlled trials are needed to draw conclusions about the efficacy and safety of neuromodulation therapy."
874fe718-0a79-4987-a8e8-2beedecde962,https://examine.com/conditions/diabetic-neuropathy,Diabetic Neuropathy,What causes diabetic neuropathy?,"The exact causes are unclear. Current evidence suggests that hyperglycemia and hyperlipidemia (persistently high blood glucose and lipids) drive neuronal oxidative stress and chronic low-grade inflammation, leading to nerve damage.[23][24][25]"
a081236f-bdfd-43ea-87c7-df9dc9ff4cee,https://examine.com/conditions/gestational-diabetes,Gestational Diabetes,What is gestational diabetes?,"Gestational diabetes is a condition characterized by abnormal glucose tolerance and high blood sugar during pregnancy. It usually develops during the second or third trimester and resolves soon after delivery. Early identification of this condition is important, as it increases the risk of health complications for both the expecting parent and the baby when left untreated.[1]This includes short-term risks (e.g., large for gestational age newborns, birth trauma, neonatal respiratory and metabolic complications, etc.)[2][3]and long-term risks (e.g., type 2 diabetes and cardiovascular disease in the parent, and later-life obesity and type 2 diabetes in the offspring).[4][5]Successful management of blood sugar greatly decreases the short- and long-term risks associated with gestational diabetes.[6]"
3506bd36-5777-405d-9167-1d774b676c85,https://examine.com/conditions/gestational-diabetes,Gestational Diabetes,What are the main signs and symptoms of gestational diabetes?,"The symptoms of gestational diabetes, like fatigue, nausea, and increased thirst and urination, are often not noticed, as they are common during pregnancy.[7]For this reason, screening for the signs of gestational diabetes is important.High blood sugar is the main sign of gestational diabetes. It is detected by blood tests that measurethe amount of glucose (sugar) in the bloodstream. There is also a blood test that can measure the amount of glucose attached to red blood cells. This is called glycated hemoglobin orhemoglobin A1c(HbA1c), and a high HbA1c is another sign of gestational diabetes. Since red blood cells survive in the bloodstream for about 2 to 3 months, testing the amount of sugar attached to them provides an indication of blood glucose concentrations over the past 2 to 3 months.[7]"
101e2d59-2974-4921-8b63-ab64e6e1ae3f,https://examine.com/conditions/gestational-diabetes,Gestational Diabetes,How is gestational diabetes diagnosed?,"Pregnant people are screened for gestational diabetes at 24 to 28 weeks of gestation. Screening methods vary and may include a one- or two-step approach.[8][9]The two-step approach is more common in the US. Both approaches use an oral glucose tolerance test (OGTT), which involves drinking a sugar-containing beverage and then taking blood samples to see how high blood sugar rises in response to the drink. If blood sugar levels are higher than established normal ranges, gestational diabetes may be diagnosed.Some pregnant people have a higher risk of gestational diabetes and may be screened before 24 weeks gestation to identify pregestational diabetes (diabetes that was present before pregnancy) and early gestational diabetes. The best test for early screening is unclear, but fasting blood glucose levels, HbA1c values, and/or OGTT are often used.[9][7]"
6723c5e1-7415-4375-bd70-1d597eeb26b2,https://examine.com/conditions/gestational-diabetes,Gestational Diabetes,What are some of the main medical treatments for gestational diabetes?,"Lifestyle change is the primary treatment for gestational diabetes.[7]This involves medical nutrition therapy (an individualized diet plan), regular physical activity, and (if appropriate) weight management counseling. Blood glucose is monitored throughout the implementation of these interventions. If lifestyle changes alone do not adequately control blood glucose or there are signs of abnormal fetal growth,insulinmay be prescribed to help lower blood glucose to achieve target ranges.[7]Other drugs (e.g., metformin and sulfonylureas) are sometimes used, but more evidence is needed to fully understand their safety for the fetus (because these medications can cross through the placenta).[10][7]"
fcc0a56a-ae3c-4827-a3fc-63c3cae02f4d,https://examine.com/conditions/gestational-diabetes,Gestational Diabetes,Have any supplements been studied for gestational diabetes?,"Yes, the effects of several supplements on gestational diabetes have been examined, includingvitamin D,[11][12]polyphenols,[13]probiotics,[11][14][15]myo-inositol,[11][16]fish oil(including omega-3 fatty acids),[11], etc. Of these, supplementation withvitamin Dor myo-inositolduring pregnancy may reduce the risk of gestational diabetes[11]. But there is currently no strong evidence to support the use of supplements to treat gestational diabetes."
4bd55690-fd27-40eb-a44c-85fa19637adc,https://examine.com/conditions/gestational-diabetes,Gestational Diabetes,How could diet affect gestational diabetes?,"Medical nutrition therapy (an individualized diet plan) is central to treating gestational diabetes and maintaining normal blood glucose levels.[7][17]No evidence supports any single diet as optimal, so people with gestational diabetes should receive nutrition counseling from a registered dietitian to tailor their diet towards specific needs and goals. This is important because a variety of dietary modifications might improve maternal and/or infant health (e.g., theDietary Approaches to Stop Hypertension diet).[17]Diet may also affect a pregnant person’s risk for gestational diabetes. Observational studies find that a dietary pattern rich in fruit, vegetables, whole grains, and fish, and low in red and processed meat, refined grains, and high-fat dairy reduced the risk of developing gestational diabetes.[18][19][11][11]"
f987fa64-714e-4a3c-8124-b8737fbb059b,https://examine.com/conditions/gestational-diabetes,Gestational Diabetes,Are there any other treatments for gestational diabetes?,"Yes. Regular exercise during pregnancy can reduce blood glucose levels and the need for medications to treat gestational diabetes.[20][21]Exercise may also reduce the risk of developing gestational diabetes.[22][23]While exercise is safe during most uncomplicated pregnancies, a clinical evaluation is recommended before engaging in an exercise program.[24]"
a8d90927-ed02-4245-a615-899b7b80b936,https://examine.com/conditions/gestational-diabetes,Gestational Diabetes,What causes gestational diabetes?,"The exact cause of gestational diabetes is not completely understood. It appears to have both a genetic basis[25]as well as environmental and lifestyle triggers (e.g., advanced age, diet, excessive weight gain,obesity, and physical inactivity).[26][27]During pregnancy, the placenta secretes hormones (such asgrowth hormone, placental lactogen,progesterone, and corticotropin-releasing hormone) to ensure the fetus gets all the nutrients it needs. These hormones, alongside other metabolic changes, make the pregnant parent’s body less responsive toinsulin, the hormone that allows glucose to leave the bloodstream and enter the body’s cells.[28]This is calledinsulin resistance. Normally, the pancreas secretes more insulin to combat this resistance and keep blood glucose under control. However, in some pregnant people, the pancreas is unable to secrete enough insulin to overcome the insulin resistance.[29][26]This causes blood sugar levels to rise beyond what is considered a healthy range and results in a diagnosis of gestational diabetes."
71520732-2be2-4a62-9a8b-4344d6e572b1,https://examine.com/conditions/metabolic-syndrome,Metabolic Syndrome,What is metabolic syndrome?,"Metabolic syndrome(MetS), sometimes called “insulin resistance syndrome” or “syndrome X”, refers to a cluster of interrelated risk factors forcardiovascular diseaseandtype 2 diabetes, specifically enlargedwaist circumference, elevatedtriglycerides,high blood pressure, lowhigh-density lipoproteincholesterol, and impairedfasting glucose.[1]It’s estimated that the global prevalence of MetS is about 25%,[2]while in the United States it’s nearly 35%.[3]"
3b5b4bf4-ab85-42f4-8072-cd1da7f9d947,https://examine.com/conditions/metabolic-syndrome,Metabolic Syndrome,What are the main signs and symptoms of metabolic syndrome?,"Other than an enlarged waist circumference, which doesn’t always indicate the presence of MetS, there are typically no obvious signs or symptoms of the disease. Therefore, an evaluation by a medical doctor and blood work will be needed to determine the presence of MetS. In some cases, an individual will present with signs of specific risk factors, such as acanthosis nigricans (a darkening of the skin that appears in skin fold areas and is associated withinsulin resistance) or xanthomas (yellowish-colored skin lesions that are associated withdyslipidemia).[1]"
1737b9b9-60bc-473d-8a9a-d45ac1a5502b,https://examine.com/conditions/metabolic-syndrome,Metabolic Syndrome,How is metabolic syndrome diagnosed?,"To be diagnosed with MetS, an individual needs to have at least 3 of the following 5 risk factors:[4]Enlarged waist circumference: ≥ 88 centimeters (35 inches) and ≥ 102 centimeters (40 inches) in women and men, respectively, with lower thresholds for Asian populations (≥ 80 centimeters and ≥ 85–90 centimeters in women and men, respectively)Elevated triglycerides: ≥ 150 mg/dL (1.7 mmol/L)High blood pressure: systolic ≥ 130 mm Hg and/or diastolic ≥ 85 mm HgLow high-density lipoprotein cholesterol: < 50 mg/dL (1.3 mmol/L) and < 40 mg/dL (1.0 mmol/L) in women and men, respectivelyImpaired fasting glucose (or drug treatment of elevated glucose levels): ≥ 100 mg/dL (5.6 mmol/L)"
7350f50d-b31e-4162-834a-70f44806d2f2,https://examine.com/conditions/metabolic-syndrome,Metabolic Syndrome,What are some of the main medical treatments for metabolic syndrome?,"The primary goal of clinical management is to reduce the risk ofcardiovascular diseaseandtype 2 diabetes.[5]Lifestyle interventions (i.e., changes in dietary and physical activity habits and smoking cessation) are the initial strategy to treat MetS, followed by pharmacological therapy — if necessary — to improve individual risk factors. There are no guidelines from medical organizations for the pharmacological treatment of MetS; pharmacological treatment depends on the individual’s unique circumstances and may include a statin to improve blood lipids, aglucagon-like peptide 1 receptor agonist(GLP-1 RA) orsodium-glucose cotransporter 2(SGLT2) inhibitor to further reduce cardiovascular disease risk, metformin to increase insulin sensitivity, and/or arenin-angiotensin system(RAS) blocker to reduce blood pressure, among other drugs.[6][7][8]In people with severe obesity, bariatric surgery is a highly effective option."
0376caf0-04b6-4af0-a564-e0a5f96b97f3,https://examine.com/conditions/metabolic-syndrome,Metabolic Syndrome,How could diet affect metabolic syndrome?,"Maintaining a healthy body weight is central to the prevention and management of MetS. Virtually any calorie-restricted diet — irrespective of its macronutrient distribution or meal frequency — that the individual can adhere to has the potential to improve MetS risk factors.[9]To achieve significant improvement of MetS risk factors, a weight loss of at least 5% of initial body weight is recommended, with greater improvements reported with further weight loss.[10]Regarding specific dietary patterns, the Mediterranean diet, which is rich in minimally processed plant foods and olive oil, has the most robust evidence of improving MetS risk factors and reducing the prevalence of MetS.[11][12]The Dietary Approaches to Stop Hypertension (DASH) diet has also been shown to improve MetS risk factors, whereas a Western diet rich in red meat, saturated fatty acids, refined grains, and sugar is associated with an increased risk of MetS.[13]"
7f0ae9a0-2290-42f6-9954-4c3f7444f69f,https://examine.com/conditions/metabolic-syndrome,Metabolic Syndrome,Have any supplements been studied for metabolic syndrome?,"Because MetS is characterized by a cluster of cardiometabolic risk factors, a wide variety of supplements are of interest, including those purported to improve blood lipids, increase insulin sensitivity, decrease blood pressure, or reduce inflammation. Some of the most studied options areberberine,red yeast rice,fish oil,biotic supplements,curcumin,vitamin D, andgarlic.[14][15]"
fbf34a22-c8e4-45bc-a556-1f5ec85a71ab,https://examine.com/conditions/metabolic-syndrome,Metabolic Syndrome,Are there any other treatments for metabolic syndrome?,"Regular exercise is important for the prevention and treatment of MetS. Sedentary behavior is associated with an increased risk of MetS,[16][17]whereas higher cardiorespiratory fitness (i.e., VO2max) is associated with a reduced risk of MetS.[18]Additionally, regular exercise has been shown to improve each MetS risk factor.[18]At a minimum, the physical activity guidelines of 150 minutes per week of moderate-intensity (or 75 minutes of vigorous-intensity) activity should be met.Sleep hygiene interventions are also potentially useful because sleep deprivation increases hunger and energy intake and decrease insulin sensitivity.[19]Moreover, short sleep duration (<6 hours per night) and sleep apnea are associated with an increased risk of MetS.[20][21]Lastly, smoking cessation is recommended for the prevention and treatment of MetS.[13]"
57ecf1d0-bc90-491a-a3eb-59cc576b8a95,https://examine.com/conditions/metabolic-syndrome,Metabolic Syndrome,What causes metabolic syndrome?,"MetS is caused by a combination of genetic[22][23]and environmental factors, namely a high caloric intake and physical inactivity.[24]The resultant excess adiposity — particularly in the intra-abdominal region (i.e., visceral fat) — leads to adipose tissue dysfunction and insulin resistance.Expansion of visceral fat and insulin resistance increases circulatingfree fatty acids(FFAs), which infiltrate the liver and skeletal muscle and disrupt glucose and lipid homeostasis.[24]The liver and skeletal muscle respond by increasing the breakdown of FFAs, which results in decreased glucose uptake in muscle along with increased glucose and triglyceride production and increased high-density lipoprotein clearance in the liver.[25][15]Additionally, expansion of visceral fat causes altered secretion of adipokines (i.e., hormones, cytokines, and other proteins secreted by fat tissue), including increased secretion of pro-inflammatory cytokines (e.g., interleukin-6, tumor necrosis factor alpha) and reduced secretion ofadiponectin, contributing to a state of chronic low-grade inflammation and a deterioration in cardiometabolic health.[26]"
7c7dc097-59b3-4d03-8dad-9413a29776f0,https://examine.com/conditions/prediabetes,Prediabetes,What is prediabetes?,"Prediabetes is a condition characterized by elevated blood glucose levels that do not meet the criteria fortype 2 diabetes. Prediabetes increases the risk ofcardiovascular diseaseandtype 2 diabetesand is associated with the presence ofobesity(especially abdominal or visceral obesity),dyslipidemia, andhigh blood pressure.[1]"
e7ab2cf5-5715-4447-8764-f504c774958d,https://examine.com/conditions/prediabetes,Prediabetes,What are the main signs and symptoms of prediabetes?,"Prediabetes is an asymptomatic condition. Signs, or indications that an individual should undergo testing to determine whether they have prediabetes, include overweight or obesity in combination with at least one of the following risk factors: family history of diabetes, high-risk race/ethnicity (i.e., Black, Latino/Hispanic, Native American, Asian American, Pacific Islander), history ofgestational diabetes,polycystic ovary syndrome,high blood pressure, lowhigh-density lipoproteincholesterol(HDL-C) levels, or elevatedtriglycerides.[1][2]Universal screening irrespective of the presence of risk factors is recommended for adults at least 35 years old. If initial screening results meet the criteria for prediabetes, it is recommended to repeat screenings yearly. If the results are normal, it is recommended to repeat screenings at least every three years, or sooner if symptoms of diabetes (e.g., excessive thirst) or other risk factors (e.g., hypertension) develop.[1]"
cb773625-c918-47bf-9463-d61b26233bc8,https://examine.com/conditions/prediabetes,Prediabetes,How is prediabetes diagnosed?,"Prediabetes is diagnosed based on either fastingplasma glucose, 2-hour plasma glucose during a 75-gramoral glucose tolerance test(OGTT), orHbA1c. According to the American Diabetes Association, an individual should be diagnosed with prediabetes if they have one of the following:[1]Fasting glucose of 100–125 mg/dL (5.6–6.9 mmol/L)2-hour glucose during an OGTT of 140–199 mg/dL (7.8–11.0 mmol/L)HbA1c of 5.7%–6.4%Notably, the World Health Organization defines the lower limit for impaired fasting glucose as 110 mg/dL (6.1 mmol/L).Evidence suggests that an OGTT is the most sensitive diagnostic test for prediabetes, and reliance on either fasting glucose or HbA1c alone may result in significant underdiagnosis of prediabetes.[3][4]"
bf322476-1022-4315-ab55-82fe99eefc64,https://examine.com/conditions/prediabetes,Prediabetes,What are some of the main medical treatments for prediabetes?,"Lifestyle intervention (i.e., weight loss, exercise, healthy eating, reduction or cessation of alcohol intake) is the cornerstone of prediabetes treatment, but metformin is considered the first-line pharmacological intervention. It’s recommended that metformin be added for people with prediabetes who have a BMI of at least 35, higher glucose levels (e.g., fasting glucose ≥ 110 mg/dL, HbA1c ≥ 6.0%), and/or a history ofgestational diabetes.[5]Metformin may also be considered in cases where lifestyle intervention is ineffective.[6]Weight-loss drugs (e.g., semaglutide) are another increasingly popular option to enhance the efficacy of lifestyle intervention.[7][8]"
d1c22440-7cde-4a78-8a84-51add64341ac,https://examine.com/conditions/prediabetes,Prediabetes,How could diet affect prediabetes?,"A hypocaloric diet is a powerful intervention for people with prediabetes and overweight or obesity, as achieving and maintaining significant weight loss (at least 5% of initial body weight) can prevent or delay the development of type 2 diabetes.[9]In the context of significant weight loss, there does not appear to be an ideal macronutrient distribution, so the diet should be customized to the individual’s dietary preferences and metabolic goals to maximize adherence.[10]Plant-based dietary patterns that emphasize the consumption of whole grains, legumes, nuts, fruits, and vegetables may be particularly beneficial for reducing the risk of type 2 diabetes.[5]"
9dea4e57-a9e3-4a91-82d7-ca3e6d53ab14,https://examine.com/conditions/prediabetes,Prediabetes,Have any supplements been studied for prediabetes?,"A wide variety of supplements hypothesized to improve glycemic control have been studied in people with prediabetes, includingzinc,vitamin D,cinnamon,berberine,curcumin,probiotics,panax ginseng,vitamin K,omega-3 fatty acids,aloe vera, and mulberry leaf extract.[11][12]"
5d99d59a-49a3-41f3-851b-7b46044e307c,https://examine.com/conditions/prediabetes,Prediabetes,Are there any other treatments for prediabetes?,"Physical activity is pivotal for preventing or delaying the development of type 2 diabetes. At least 150 minutes of moderate-intensity physical activity (e.g., brisk walking) plus two resistance exercise sessions should be performed each week to promote further improvements in insulin sensitivity.[5][13][14]Additionally, breaking up periods of sitting with standing or walking can improve postprandial (after-meal) glucose levels.[15]Tobacco cessation is also recommended.[5]"
093d328c-048c-4b3e-bb03-72dae67e41c8,https://examine.com/conditions/prediabetes,Prediabetes,What causes prediabetes?,"The causes of prediabetes overlap with those oftype 2 diabetes, as the physiological defects that underlie the latter — insulin resistance and loss of pancreatic beta-cell (cells that produce and secrete insulin) function — are also present in prediabetes,[16][17]albeit to a lesser extent than in type 2 diabetes.The causes of prediabetes are multifactorial and are influenced by genetic predisposition and environment. However, excess energy intake and sedentary behavior, leading to the accumulation of more visceral fat than the individual can tolerate, are primarily responsible for the hyperglycemia that defines prediabetes.[18]"
